{
  "banner": "model estimate, not EMG",
  "prototypes": [
    {
      "id": "moment_arm",
      "name": "Finite-difference moment arm"
    },
    {
      "id": "opensim_arm",
      "name": "OpenSim arm26 moment arm"
    },
    {
      "id": "static_opt",
      "name": "Static optimization"
    }
  ],
  "items": [
    {
      "id": "biceps_flexion",
      "name": "Biceps flexion",
      "note": "Isolate. No external load.",
      "negative_control": false
    },
    {
      "id": "triceps_extension",
      "name": "Triceps extension",
      "note": "Isolate. No external load.",
      "negative_control": false
    },
    {
      "id": "glute_max_hip_extension",
      "name": "Glute max hip extension",
      "note": "Isolate. No external load.",
      "negative_control": false
    },
    {
      "id": "elbow_extension_as_biceps_curl",
      "name": "Biceps curl",
      "note": "Elbow-extension clip labeled as a biceps curl",
      "negative_control": true
    },
    {
      "id": "squat",
      "name": "Squat",
      "note": "Scripted squat with a vertical load over the midfoot. No held-out person track.",
      "negative_control": false
    },
    {
      "id": "face_pull",
      "name": "Face pull",
      "note": "Scripted face pull. The load is a cable pulling forward from the hands. No held-out person track.",
      "negative_control": false
    },
    {
      "id": "rotator_cuff_force_couple",
      "name": "Rotator-cuff couple",
      "note": "Teaching claim: subscapularis opposes infraspinatus and teres minor. Not a pose match.",
      "negative_control": false
    },
    {
      "id": "lat_pulldown_as_face_pull",
      "name": "Face pull",
      "note": "Lat pulldown clip labeled as a face pull",
      "negative_control": true
    }
  ],
  "cells": [
    {
      "prototype_id": "moment_arm",
      "item_id": "biceps_flexion",
      "status": "pass",
      "reason": "Top-5 overlap 1.00. Prime movers match the action-table sign. No held-out track.",
      "scores": {
        "legality": {
          "status": "pass",
          "reason": "Every frame is inside toy_sagittal_v1 limits."
        },
        "joint_path": {
          "status": "abstain",
          "reason": "No held-out track."
        },
        "muscle_role": {
          "status": "pass",
          "reason": "Top-5 overlap 1.00. Prime movers match the action-table sign."
        },
        "negative_control": {
          "status": "not_applicable",
          "reason": "This item is not a negative control."
        },
        "force_couple": {
          "status": "not_applicable",
          "reason": "This item has no force-couple claim."
        }
      },
      "muscle_role": {
        "overlap": 1.0,
        "predicted_top5": [
          "biceps_brachii",
          "brachioradialis",
          "brachialis",
          "posterior_deltoid",
          "latissimus_dorsi"
        ],
        "reference_working": [
          "biceps_brachii",
          "brachialis",
          "brachioradialis"
        ],
        "sign_violations": []
      },
      "score_path": "moment_arm/biceps_flexion/score.json",
      "emission_path": "moment_arm/biceps_flexion/emission.json",
      "playback_path": "moment_arm/biceps_flexion/playback.json"
    },
    {
      "prototype_id": "moment_arm",
      "item_id": "triceps_extension",
      "status": "pass",
      "reason": "Top-5 overlap 1.00. Prime movers match the action-table sign. No held-out track.",
      "scores": {
        "legality": {
          "status": "pass",
          "reason": "Every frame is inside toy_sagittal_v1 limits."
        },
        "joint_path": {
          "status": "abstain",
          "reason": "No held-out track."
        },
        "muscle_role": {
          "status": "pass",
          "reason": "Top-5 overlap 1.00. Prime movers match the action-table sign."
        },
        "negative_control": {
          "status": "not_applicable",
          "reason": "This item is not a negative control."
        },
        "force_couple": {
          "status": "not_applicable",
          "reason": "This item has no force-couple claim."
        }
      },
      "muscle_role": {
        "overlap": 1.0,
        "predicted_top5": [
          "triceps_brachii",
          "anterior_deltoid"
        ],
        "reference_working": [
          "triceps_brachii"
        ],
        "sign_violations": []
      },
      "score_path": "moment_arm/triceps_extension/score.json",
      "emission_path": "moment_arm/triceps_extension/emission.json",
      "playback_path": "moment_arm/triceps_extension/playback.json"
    },
    {
      "prototype_id": "moment_arm",
      "item_id": "glute_max_hip_extension",
      "status": "pass",
      "reason": "Top-5 overlap 1.00. Prime movers match the action-table sign. No held-out track.",
      "scores": {
        "legality": {
          "status": "pass",
          "reason": "Every frame is inside toy_sagittal_v1 limits."
        },
        "joint_path": {
          "status": "abstain",
          "reason": "No held-out track."
        },
        "muscle_role": {
          "status": "pass",
          "reason": "Top-5 overlap 1.00. Prime movers match the action-table sign."
        },
        "negative_control": {
          "status": "not_applicable",
          "reason": "This item is not a negative control."
        },
        "force_couple": {
          "status": "not_applicable",
          "reason": "This item has no force-couple claim."
        }
      },
      "muscle_role": {
        "overlap": 1.0,
        "predicted_top5": [
          "gluteus_maximus",
          "biceps_femoris",
          "vastus_lateralis"
        ],
        "reference_working": [
          "gluteus_maximus",
          "biceps_femoris"
        ],
        "sign_violations": []
      },
      "score_path": "moment_arm/glute_max_hip_extension/score.json",
      "emission_path": "moment_arm/glute_max_hip_extension/emission.json",
      "playback_path": "moment_arm/glute_max_hip_extension/playback.json"
    },
    {
      "prototype_id": "moment_arm",
      "item_id": "elbow_extension_as_biceps_curl",
      "status": "pass",
      "reason": "Muscle role failed, as required for a negative control.",
      "scores": {
        "legality": {
          "status": "pass",
          "reason": "Every frame is inside toy_sagittal_v1 limits."
        },
        "joint_path": {
          "status": "abstain",
          "reason": "No held-out track."
        },
        "muscle_role": {
          "status": "fail",
          "reason": "Prime mover with the wrong moment-arm sign: triceps_brachii (elbow_flexion sign -1 against required +1)."
        },
        "negative_control": {
          "status": "pass",
          "reason": "Muscle role failed, as required for a negative control."
        },
        "force_couple": {
          "status": "not_applicable",
          "reason": "This item has no force-couple claim."
        }
      },
      "muscle_role": {
        "overlap": 0.0,
        "predicted_top5": [
          "triceps_brachii",
          "anterior_deltoid"
        ],
        "reference_working": [
          "biceps_brachii",
          "brachialis",
          "brachioradialis"
        ],
        "sign_violations": [
          "triceps_brachii (elbow_flexion sign -1 against required +1)"
        ]
      },
      "score_path": "moment_arm/elbow_extension_as_biceps_curl/score.json",
      "emission_path": "moment_arm/elbow_extension_as_biceps_curl/emission.json",
      "playback_path": "moment_arm/elbow_extension_as_biceps_curl/playback.json"
    },
    {
      "prototype_id": "moment_arm",
      "item_id": "squat",
      "status": "pass",
      "reason": "Top-5 overlap 0.67. Prime movers match the action-table sign. No held-out track.",
      "scores": {
        "legality": {
          "status": "pass",
          "reason": "Every frame is inside toy_sagittal_v1 limits."
        },
        "joint_path": {
          "status": "abstain",
          "reason": "No held-out track."
        },
        "muscle_role": {
          "status": "pass",
          "reason": "Top-5 overlap 0.67. Prime movers match the action-table sign."
        },
        "negative_control": {
          "status": "not_applicable",
          "reason": "This item is not a negative control."
        },
        "force_couple": {
          "status": "not_applicable",
          "reason": "This item has no force-couple claim."
        }
      },
      "muscle_role": {
        "overlap": 0.6667,
        "predicted_top5": [
          "gluteus_maximus",
          "vastus_lateralis"
        ],
        "reference_working": [
          "gluteus_maximus",
          "vastus_lateralis",
          "biceps_femoris"
        ],
        "sign_violations": []
      },
      "score_path": "moment_arm/squat/score.json",
      "emission_path": "moment_arm/squat/emission.json",
      "playback_path": "moment_arm/squat/playback.json"
    },
    {
      "prototype_id": "moment_arm",
      "item_id": "face_pull",
      "status": "pass",
      "reason": "Top-5 overlap 0.80. Prime movers match the action-table sign. No held-out track.",
      "scores": {
        "legality": {
          "status": "pass",
          "reason": "Every frame is inside toy_sagittal_v1 limits."
        },
        "joint_path": {
          "status": "abstain",
          "reason": "No held-out track."
        },
        "muscle_role": {
          "status": "pass",
          "reason": "Top-5 overlap 0.80. Prime movers match the action-table sign."
        },
        "negative_control": {
          "status": "not_applicable",
          "reason": "This item is not a negative control."
        },
        "force_couple": {
          "status": "not_applicable",
          "reason": "This item has no force-couple claim."
        }
      },
      "muscle_role": {
        "overlap": 0.8,
        "predicted_top5": [
          "posterior_deltoid",
          "middle_trapezius",
          "rhomboid_major",